DOI,Titulo,Autores,Abstract,Fecha,Seccion
10.3168/jds.2014-8449,"Feed conversion efficiency in dairy cows: Repeatability, variation in digestion and metabolism of energy and nitrogen, and ruminal methanogens","C Arndt,J M Powell,M J Aguerre,P M Crump,M A Wattiaux","The objective was to study repeatability and sources of variation in feed conversion efficiency [FCE, milk kg/kg dry matter intake (DMI)] of lactating cows in mid to late lactation. Trials 1 and 2 used 16 cows (106 to 368 d in milk) grouped in 8 pairs of 1 high- and 1 low-FCE cow less than 16 d in milk apart. Trial 1 determined the repeatability of FCE during a 12-wk period. Trial 2 quantified the digestive and metabolic partitioning of energy and N with a 3-d total fecal and urine collection and measurement of CH4 and CO2 emission. Trial 3 studied selected ruminal methanogens in 2 pairs of cows fitted with rumen cannulas. Cows received a single diet including 28% corn silage, 27% alfalfa silage, 17% crude protein, and 28% neutral detergent fiber (dry matter basis). In trial 1, mean FCE remained repeatedly different and averaged 1.83 and 1.03 for high- and low-FCE cows, respectively. In trial 2, high-FCE cows consumed 21% more DMI, produced 98% more fat- and protein-corrected milk, excreted 42% less manure per kilogram of fat- and protein-corrected milk, but emitted the same daily amount of CH4 and CO2 compared with low-FCE cows. Percentage of gross energy intake lost in feces was higher (28.6 vs. 25.9%), but urinary (2.76 vs. 3.40%) and CH4 (5.23 vs. 6.99%) losses were lower in high- than low-FCE cows. Furthermore, high-FCE cows partitioned 15% more of gross energy intake toward net energy for maintenance, body gain, and lactation (37.5 vs. 32.6%) than low-FCE cows. Lower metabolic efficiency and greater heat loss in low-FCE cows might have been associated in part with greater energy demand for immune function related to subclinical mastitis, as somatic cell count was 3.8 fold greater in low- than high-FCE cows. As a percentage of N intake, high-FCE cows tended to have greater fecal N (32.4 vs. 30.3%) and had lower urinary N (32.2 vs. 41.7%) and greater milk N (30.3 vs. 19.1%) than low-FCE cows. In trial 3, Methanobrevibacter spp. strain AbM4 was less prevalent in ruminal content of high-FCE cows, which emitted less CH4 per unit of DMI and per unit of neutral detergent fiber digested than low-FCE cows. Thus lower digestive efficiency was more than compensated by greater metabolic efficiencies in high- compared with low-FCE cows. There was not a single factor, but rather a series of mechanisms involved in the observed differences in efficiency of energy utilization of the lactating cows in this study.",06/2015,Journal of dairy science
10.1523/JNEUROSCI.1233-23.2025,Frontostriatal Networks Undergo Functional Specialization During Adolescence that Follows a Ventral-Dorsal Gradient: Developmental Trajectories and Longitudinal Associations,"Samuel D Klein,Paul F Collins,Vanessa Lozano-Wun,Peter Grund,Monica Luciana","Seminal studies in animal neuroscience demonstrate that frontostriatal circuits exhibit a ventral-dorsal functional gradient to integrate neural functions related to reward processing and cognitive control. Prominent neurodevelopmental models posit that heightened reward-seeking and risk-taking during adolescence result from maturational imbalances between frontostriatal neural systems underlying reward processing and cognitive control. The present study investigated whether the development of ventral (VS) and dorsal (DS) striatal resting-state connectivity (rsFC) networks along this proposed functional gradient relates to putative imbalances between reward and executive systems posited by a dual neural systems theory of adolescent development. 163 participants aged 11-25 years (54% female, 90% white) underwent resting scans at baseline and biennially thereafter, yielding 339 scans across four assessment waves. We observed developmental increases in VS rsFC with brain areas implicated in reward processing (e.g., subgenual cingulate gyrus and medial orbitofrontal cortex) and concurrent decreases with areas implicated in executive function (e.g., ventrolateral and dorsolateral prefrontal cortices). DS rsFC exhibited the opposite pattern. More rapid developmental increases in VS rsFC with reward areas were associated with developmental improvements in reward-based decision making, whereas increases in DS rsFC with executive function areas were associated with improved executive function, though each network exhibited some crossover in function. Collectively, these findings suggest that typical adolescent neurodevelopment is characterized by a divergence in ventral and dorsal frontostriatal connectivity that may relate to developmental improvements in affective decision-making and executive function. Significance Statement Anatomical studies in nonhuman primates demonstrate that frontostriatal circuits are essential for integration of neural functions underlying reward processing and cognition, with human neuroimaging studies linking alterations in these circuits to psychopathology. The present study characterized the developmental trajectories of frontostriatal resting state networks from childhood to young adulthood. We demonstrate that ventral and dorsal aspects of the striatum exhibit distinct age-related changes that predicted developmental improvements in reward-related decision making and executive function. These results highlight that adolescence is characterized by distinct changes in frontostriatal networks that may relate to normative increases in risk-taking. Atypical developmental trajectories of frontostriatal networks may contribute to adolescent-onset psychopathology.",10/03/2025,The Journal of neuroscience : the official journal of the Society for Neuroscience
10.1016/j.ccell.2025.02.006,CDK4 selective inhibition improves preclinical anti-tumor efficacy and safety,"Cynthia L Palmer,Britton Boras,Bernadette Pascual,Na Li,Danan Li,Scott Garza,Nanni Huser,Jing Tang Yuan,Julie A Cianfrogna,Tae Sung,Elizabeth McMillan,Na Wei,Jason Carmody,Aubrey Nayeon Kang,Seth Darensburg,Taran Dodd,James V Oakley,James Solowiej,Lisa Nguyen,Suvi T M Orr,Ping Chen,Eric Johnson,Xiu Yu,Wade C Diehl,Gary M Gallego,Mehran Jalaie,Rose Ann Ferre,Sujin Cho-Schultz,Hong Shen,Judith G Deal,Qin Zhang,Timothy R Baffi,Meirong Xu,Whijae Roh,Jennifer Lapira-Miller,Jerome Goudeau,Yanke Yu,Rajat Gupta,Kimberly Kim,Stephen G Dann,Zhengyan Kan,John C Kath,Sajiv K Nair,Nichol Miller,Brion W Murray,Andrew R Nager,Casey Quinlan,Matthew D Petroski,Cathy Zhang,Aida Sacaan,Todd VanArsdale,Lars Anders","CDK4/6 inhibitors have revolutionized treatment of hormone receptor positive (HR+), HER2 non-amplified (HER2-) breast cancer. Yet, all ""dual"" CDK4/6 inhibitors show common dose-limiting hematologic toxicities, foremost neutropenia. This poses challenges to provide these agents at concentrations necessary to extinguish cell cycling in tumors. HR+ breast cancer cells are highly dependent on CDK4 but not CDK6. By contrast, CDK4 is dispensable for human bone marrow derived cells, due to the primary and compensatory role of CDK6 in hematopoiesis. This prompted us to develop atirmociclib (PF-07220060), a next-generation CDK4 selective inhibitor. Atirmociclib's impact on circulating neutrophils was reduced, in proportion with its increase in CDK4 versus CDK6 selectivity. Realized dose intensification led to greater CDK4 inhibition and deeper anti-tumor responses, pointing to CDK4 target coverage as a limiting factor of CDK4/6 inhibitor efficacy. We also highlight combinatorial agents that may counter acquired resistance to CDK4 selective inhibition and widen its clinical application.",10/03/2025,Cancer cell
10.1088/1361-6560/aca3f8,Experimental feasibility of xenon-enhanced dual-energy radiography for imaging of lung function,"Fateen Basharat,Jesse Tanguay","Chronic obstructive pulmonary disease (COPD) is a leading cause of death worldwide. We experimentally investigated the feasibility of two-dimensional xenon-enhanced dual-energy (XeDE) radiography for imaging of lung function. We optimized image quality under quantum-noise-limited conditions using a chest phantom consisting of a rectangular chamber representing the thoracic volume and PMMA slabs simulating x-ray attenuation by soft tissue. A sealed, air-filled cavity with thin PMMA walls was positioned inside the chamber to simulate a 2 cm thick ventilation defect. The chamber was ventilated with xenon and dual-energy imaging was performed using a diagnostic x-ray tube and a flat-panel detector. The contrast-to-noise ratio of ventilation defects normalized by patient x-ray exposure maximized at a kV-pair of approximately 60/140-kV and when approximately one third of the total exposure was allocated to the HE image. We used the optimized technique to image a second phantom that contained lung-parenchyma-mimicking PMMA clutter, rib-mimicking aluminum slats and an insert that simulated ventilation defects with thicknesses ranging from 0.5 cm to 2 cm and diameters ranging from 1 cm to 2 cm. From the resulting images we computed the area under the receiver operating characteristic curve (AUC) of the non-prewhitening model observer with an eye filter and internal noise. For a xenon concentration of 75%, good AUCs (i.e. 0.8-0.9) to excellent AUCs (i.e. >0.9) were obtained when the defect diameter is greater than 1.3 cm and defect thickness is 1 cm. When the xenon concentration was reduced to 50%, the AUC was ∼0.9 for defects 1.2 cm in diameter and ∼1.5 cm in thickness. Two-dimensional XeDE radiography may therefore enable detection of functional abnormalities associated with early-stage COPD, for which xenon ventilation defects can occupy up to 20% of the lung volume, and should be further developed as a low-cost alternative to MRI-based approaches and a low-dose alternative to CT-based approaches.",12/12/2022,Physics in medicine and biology
10.1182/blood.2024025102,Large-scale dependency and drug screens characterize the therapeutic vulnerabilities of Multiple Myeloma with 1q,"Romanos Sklavenitis-Pistofidis,Elizabeth D Lightbody,Mairead Reidy,Junko Tsuji,Jean-Baptiste Alberge,Michelle P Aranha,Daniel Lewis Heilpern-Mallory,Harvey G Roweth,Daisy Huyng,Stephen Jun Fei Chong,Anna Y Chung,Jeremy Zhang,Liam Hackett,Nicholas J Haradhvala,Ting Wu,Nang Kham Su,Brianna Berrios,Saveliy Belkin,Ankit K Dutta,Ryan A Knudson,Carolyn Brandt,Patricia T Greipp,Matthew S Davids,Maria Papaioannou,Gad Getz,Irene M Ghobrial,Salomon Manier","The development of targeted therapy for patients with multiple myeloma (MM) is hampered by the low frequency of actionable genetic abnormalities. Gain or amplification of chromosome 1q (1q+) is the most frequent arm-level copy number gain in patients with MM and is associated with higher risk of progression and death despite recent therapeutic advances. Thus, developing targeted therapy for MM patients with 1q+ stands to benefit a large portion of patients in need of more effective management. Here, we employed large-scale dependency screens and drug screens to systematically characterize the therapeutic vulnerabilities of MM with 1q+ and displayed increased sensitivity to MCL1 and PI3K inhibitors. Using single-cell RNA sequencing, we compared subclones with and without 1q+ within the same patient tumors and demonstrated that 1q+ is associated with higher levels of MCL1 and the PI3K pathway. Furthermore, by isolating isogenic clones with different copy number profiles for part of the chromosome 1q arm, we observed increased sensitivity to MCL1 and PI3K inhibitors with arm-level gain. Lastly, we demonstrated synergy between MCL1 and PI3K inhibitors and dissected their mechanism of action in MM with 1q+, uncovering a cytostatic effect. In conclusion, this study highlights that MM with 1q+ may present enhanced sensitivity to MCL1 and PI3K inhibitors, enabling their use at lower doses without sacrificing efficacy, and may thus accelerate the development of targeted therapy for patients with MM and 1q+.",12/03/2025,Blood
10.1126/scitranslmed.adp2124,Heterogeneous cellular responses to hyperthermia support combined intraperitoneal hyperthermic immunotherapy for ovarian cancer mouse models,"Xingyuan Hu,Xiaoyan Kang,Faming Zhao,Yaoyuan Cui,Yu Fu,Xiaohang Yang,Jingjing Yin,Wenting Li,Junpeng Fan,Bin Yang,Zixuan Fang,Tianyu Qin,Xucui Zhuang,Yiting Liu,Chenzhao Feng,Yunyi Yang,Funian Lu,Li Zhang,Weihao Chen,Miaofang Wu,Ning Du,Xia Sheng,Xin Zhou,Jing Li,Gang Chen,Chaoyang Sun","The benefit of hyperthermic intraperitoneal chemotherapy (HIPEC) in ovarian cancer remains controversial, hindering the development of rational combination therapies based on hyperthermia (HT). This study reports the preliminary results of the neoadjuvant HIPEC (NHIPEC) trial (ChiCTR2000038173), demonstrating enhanced tumor response in high-grade serous ovarian cancer with NHIPEC. Through single-cell RNA sequencing analysis, we identified both homogeneous and heterogeneous cellular responses to HT within the tumor and microenvironment. Epithelial-mesenchymal transition-activated tumor cells and matrix metallopeptidase 11 (MMP-11) + cancer-associated fibroblasts (CAFs) exhibited greater reductions and higher sensitivity to HT. CUT&Tag and RNA sequencing integration unveiled the differential binding programs and transcriptional regulatory mechanisms of HSF1 under normothermia (NT) and HT in tumor cells and CAFs. Furthermore, HT ameliorated the immunosuppressive tumor microenvironment, and in vivo mouse models confirmed the combined antitumor effects of HT and programmed cell death ligand 1 blockade. These findings provide an innovative strategy for rational combination therapy with HT in ovarian cancer.",12/03/2025,Science translational medicine
10.1126/scitranslmed.adp2124,Heterogeneous cellular responses to hyperthermia support combined intraperitoneal hyperthermic immunotherapy for ovarian cancer mouse models,"Xingyuan Hu,Xiaoyan Kang,Faming Zhao,Yaoyuan Cui,Yu Fu,Xiaohang Yang,Jingjing Yin,Wenting Li,Junpeng Fan,Bin Yang,Zixuan Fang,Tianyu Qin,Xucui Zhuang,Yiting Liu,Chenzhao Feng,Yunyi Yang,Funian Lu,Li Zhang,Weihao Chen,Miaofang Wu,Ning Du,Xia Sheng,Xin Zhou,Jing Li,Gang Chen,Chaoyang Sun","The benefit of hyperthermic intraperitoneal chemotherapy (HIPEC) in ovarian cancer remains controversial, hindering the development of rational combination therapies based on hyperthermia (HT). This study reports the preliminary results of the neoadjuvant HIPEC (NHIPEC) trial (ChiCTR2000038173), demonstrating enhanced tumor response in high-grade serous ovarian cancer with NHIPEC. Through single-cell RNA sequencing analysis, we identified both homogeneous and heterogeneous cellular responses to HT within the tumor and microenvironment. Epithelial-mesenchymal transition-activated tumor cells and matrix metallopeptidase 11 (MMP-11) + cancer-associated fibroblasts (CAFs) exhibited greater reductions and higher sensitivity to HT. CUT&Tag and RNA sequencing integration unveiled the differential binding programs and transcriptional regulatory mechanisms of HSF1 under normothermia (NT) and HT in tumor cells and CAFs. Furthermore, HT ameliorated the immunosuppressive tumor microenvironment, and in vivo mouse models confirmed the combined antitumor effects of HT and programmed cell death ligand 1 blockade. These findings provide an innovative strategy for rational combination therapy with HT in ovarian cancer.",12/03/2025,Science translational medicine
10.1016/j.tjpad.2025.100129,Opposite causal effects of type 2 diabetes and metformin on Alzheimer's disease,"Dongming Liu,Hongbao Cao,Ancha Baranova,Chenxin Xu,Fuquan Zhang","Background: Type 2 diabetes (T2D) is commonly co-morbid with Alzheimer's disease (AD). However, it remains unclear whether T2D itself or the antidiabetic drug metformin contributes to the progression of AD.",09/03/2025,The journal of prevention of Alzheimer's disease
10.1126/science.adm9805,Direct sensing of dietary ω-6 linoleic acid through FABP5-mTORC1 signaling,"Nikos Koundouros,Michal J Nagiec,Nayah Bullen,Evan K Noch,Guillermo Burgos-Barragan,Zhongchi Li,Long He,Sungyun Cho,Bobak Parang,Dominique Leone,Eleni Andreopoulou,John Blenis","Diet influences macronutrient availability to cells, and although mechanisms of sensing dietary glucose and amino acids are well characterized, less is known about sensing lipids. We defined a nutrient signaling mechanism involving fatty acid-binding protein 5 (FABP5) and mechanistic target of rapamycin complex 1 (mTORC1) that is activated by the essential polyunsaturated fatty acid (PUFA) ω-6 linoleic acid (LA). FABP5 directly bound to the regulatory-associated protein of mTOR (Raptor) to enhance formation of functional mTORC1 and substrate binding, ultimately converging on increased mTOR signaling and proliferation. The amounts of FABP5 protein were increased in tumors and serum from triple-negative compared with those from receptor-positive breast cancer patients, which highlights its potential role as a biomarker that mediates cellular responses to ω-6 LA intake in this disease subtype.",14/03/2025,"Science (New York, N.Y.)"
10.1126/science.ado4188,Metabolic signaling of ceramides through the FPR2 receptor inhibits adipocyte thermogenesis,"Hui Lin,Chuanshun Ma,Kui Cai,Lulu Guo,Xuemei Wang,Lin Lv,Chao Zhang,Jun Lin,Daolai Zhang,Chuan Ye,Tengwei Wang,Shenming Huang,Jifei Han,Zihao Zhang,Junyan Gao,Mingxiang Zhang,Zhao Pu,Fengyang Li,Yongyuan Guo,Xiaojun Zhou,Chengxue Qin,Fan Yi,Xiao Yu,Wei Kong,Changtao Jiang,Jin-Peng Sun","Ceramides play a central role in human health and disease, yet their role as systemic signaling molecules remain poorly understood. In this work, we identify FPR2 as a membrane receptor that specifically binds long-chain ceramides (C14-C20). In brown and beige adipocytes, C16:0 ceramide binding to FPR2 inhibits thermogenesis via G i -cyclic AMP signaling pathways, an effect that is reversed in the absence of FPR2. We present three cryo-electron microscopy structures of FPR2 in complex with G i trimers bound to C16:0, C18:0 and C20:0 ceramides. The hydrophobic tails are deeply embedded in the orthosteric ligand pocket, which has a limited amount of plasticity. Modification of the ceramide binding motif in closely related receptors, such as FPR1 or FPR3, converts them from inactive to active ceramide receptors. Our findings provide a structural basis for adipocyte thermogenesis mediated by FPR2.",13/03/2025,"Science (New York, N.Y.)"
10.1001/jama.2025.1483,Atezolizumab in High-Risk Locally Advanced Squamous Cell Carcinoma of the Head and Neck: A Randomized Clinical Trial,"Robert Haddad,Jérôme Fayette,Maria Teixeira,Kumar Prabhash,Ricard Mesia,Andrzej Kawecki,Arunee Dechaphunkul,José Dinis,Ye Guo,Muneyuki Masuda,Ching-Yun Hsieh,Maria Grazia Ghi,Claudia Vaz de Melo Sette,Kevin Harrington,Makoto Tahara,Nabil F Saba,Agnes Lau,Tao Jiang,Yibing Yan,Marcus Ballinger,Monika Kaul,Christina Matheny,Vaikunth Cuchelkar,Deborah J Wong","Importance: Treating locally advanced squamous cell carcinoma of the head and neck (LA SCCHN) involves any combination of surgery, radiation, and chemotherapy, followed by routine monitoring for local recurrence or distant metastases. Given the poor patient outcomes, a significant unmet clinical need for improved treatment options remains.",13/03/2025,JAMA
10.1016/j.molcel.2025.02.011,The role of protein lactylation: A kaleidoscopic post-translational modification in cancer,"Marta Iozzo,Elisa Pardella,Elisa Giannoni,Paola Chiarugi","The recently discovered lysine lactylation represents a critical post-translational modification with widespread implications in epigenetics and cancer biology. Initially identified on histones, lysine lactylation has been also described on non-histone proteins, playing a pivotal role in transcriptional activation, protein function, and cellular processes. Two major sources of the lactyl moiety have been currently distinguished: L-lactyl-CoA (precursor of the L-lactyl moiety) and S-D-lactylglutathione (precursor of the D-lactyl moiety), which enable enzymatic and non-enzymatic mechanisms of lysine lactylation, respectively. Although the specific writers, erasers, and readers of this modification are still unclear, acetyltransferases and deacetylases have been proposed as crucial mediators of lysine lactylation. Remarkably, lactylation exerts significant influence on critical cancer-related pathways, thereby shaping cellular behavior during malignant transformation and the metastatic cascade. Hence, as recent insights into lysine lactylation underscore its growing potential in tumor biology, targeting this modification is emerging as a significant opportunity for cancer treatment.",05/03/2025,Molecular cell
10.1182/blood.2024027109,Efficacy of Combined CD38 and PD1 Inhibition with Isatuximab and Cemiplimab for Relapsed/Refractory NK/T-Cell Lymphoma,"Seok Jin Kim,Jing Quan Lim,Sang Eun Yoon,Deok-Hwan Yang,Ji Hyun Lee,Sung Yong Oh,Yoon Seok Choi,Seong Hyun Jeong,Min Kyoung Kim,Sung-Nam Lim,Junhun Cho,Bon Park,Kyung Ju Ryu,Seunghyun Choi,Yoon Park,Kerry May Huifen Lim,Nur Ayuni Binte Muhammad Taib,Choon Kiat Ong,Soon Thye Lim,Won Seog Kim","This study aimed to assess the efficacy and safety of combining cemiplimab, an anti-PD1 antibody, with isatuximab, an anti-CD38 antibody, in relapsed or refractory extranodal NK/T-cell lymphoma (R/R ENKTL). The hypothesis was that CD38 blockade could enhance the antitumor activity of PD1 inhibitors. Eligible patients received cemiplimab (250 mg on days 1 and 15) and isatuximab (10 mg/kg on days 2 and 16) intravenously every four weeks for six cycles. Responders then received cemiplimab (350 mg) and isatuximab (10 mg/kg) every three weeks for up to 24 months. The primary endpoint was the complete response (CR) rate based on the best response. Out of 37 patients enrolled, the CR rate was 51% (19/37), exceeding the primary endpoint of 40%, and the objective response rate was 65% (24/37). After a median follow-up of 30.2 months (95% CI: 25.6-34.8 months), the median progression-free survival was 9.5 months (95% CI: 1.4-17.6 months), while the median overall survival had not yet been reached. Patients achieving CR received a median of 28 cycles (range: 4-33), and the median duration of response for responders (n = 24) was 29.4 months (95% CI: 15.4-43.4 months). Structural variations disrupting the 3'-UTR of PD-L1 and high PD-L1 expression were observed in responders. Most adverse events were mild (grade 1-2), with grade ≥3 events (32%) and no treatment-related deaths. The combination of isatuximab and cemiplimab demonstrated sustained antitumor activity and a manageable safety profile in R/R ENKTL. This phase II trial is registered at www.clinicaltrials.gov as #NCT04763616 .",12/03/2025,Blood
10.1182/blood.2024027109,Instantly Converting Atrial Fibrillation into Sinus Rhythm by a Digital Rectal Exam on a 29-year-Old Male,Cheng-Huai Ruan,"Vagal maneuvers cause increase in vagal tone, which has been shown to slow many types supraventricular tachycardia, such as atrial fibrillation (AF). However, the conversion of AF to sinus rhythm is usually not associated with vagal manuvers. Thus, AF is classically treated with medication and electrical cardioversion. Here, we present a 29-year-old male with no cardiovascular history and a low atherosclerotic risk profile who developed AF which converted into sinus rhythm immediately after a digital rectal exam. The patient remained asymptomatic after a 3-month follow-up. This implies that the digital rectal exam can be considered as an additional attempt to convert AF to sinus rhythm in AF patients.",2010,Clinical medicine insights. Case reports
10.1016/j.jacc.2024.11.042,Efficacy of Acoramidis on All-Cause Mortality and Cardiovascular Hospitalization in Transthyretin Amyloid Cardiomyopathy,"Daniel P Judge,Kevin M Alexander,Francesco Cappelli,Marianna Fontana,Pablo Garcia-Pavia,Simon D J Gibbs,Martha Grogan,Mazen Hanna,Ahmad Masri,Mathew S Maurer,Laura Obici,Prem Soman,Xiaofan Cao,Ted Lystig,Jean-François Tamby,Suresh Siddhanti,Adam Castaño,Leonid Katz,Jonathan C Fox,Kenneth W Mahaffey,Julian D Gillmore","Background: Transthyretin amyloid cardiomyopathy (ATTR-CM) is an underdiagnosed chronic disease associated with progressive heart failure that results in impaired quality of life, repeated hospitalizations, and premature death. Acoramidis is a selective, oral transthyretin stabilizer recently approved by the U.S. Food and Drug Administration for the treatment of ATTR-CM. In a phase 3, randomized, double-blind study (ATTRibute-CM [Efficacy and Safety of AG10 in Subjects With Transthyretin Amyloid Cardiomyopathy]), acoramidis was well tolerated and showed clinical efficacy in improving the primary endpoint, a hierarchical combination of all-cause mortality (ACM), cardiovascular-related hospitalization (CVH), N-terminal pro-B-type natriuretic peptide level, and 6-minute walk distance.",18/03/2025,Journal of the American College of Cardiology
