DOI,Titulo,Autores,Abstract,Fecha,Seccion
10.1091/mbc.E12-02-0159,An MBoC favorite: gangliosides GM1 and GM3 in the living cell membrane form clusters susceptible to cholesterol depletion and chilling,Akihiro Kusumi,Sin Abstract,10/2012,Molecular biology of the cell
10.1158/0008-5472.CAN-24-1879,Genomic Characterization of High-Grade Serous Ovarian Carcinoma Reveals Distinct Somatic Features in Black Individuals,"Katherine A Lawson-Michod,Jeffrey R Marks,Lindsay J Collin,David A Nix,Natalie R Davidson,Chad D Huff,Yao Yu,Aaron Atkinson,Courtney E Johnson,Lucas A Salas,Lauren C Peres,Casey S Greene,Joellen M Schildkraut,Jennifer A Doherty","Black individuals experience worse survival after a diagnosis of high-grade serous ovarian carcinoma (HGSC) than White individuals and are underrepresented in ovarian cancer research. To date, the understanding of the molecular and genomic heterogeneity of HGSC is based primarily on the evaluation of tumors from White individuals. In the present study, we performed whole exome sequencing on HGSC samples from 211 Black patients to identify significantly mutated genes and characterize mutational signatures, assessing their distributions by gene expression subtypes. The occurrence and frequency of somatic mutations and signatures by self-reported race were compared to historical data from The Cancer Genome Atlas (TCGA). Despite technical differences (e.g., formalin-fixed vs. fresh-frozen tissue), the distribution of mutations and their variant classifications for major HGSC genes were nearly identical across study populations. However, de novo significantly mutated gene analysis identified genes not previously reported in the TCGA analysis, including the oncogene KRAS and the potential tumor suppressor OBSCN. The prevalence of the homologous recombination deficiency signature was higher among Black individuals with the immunoreactive gene expression subtype compared with the mesenchymal and proliferative subtypes. These findings were confirmed by comparing the data from Black patients to 123 White patients with identical tissue collection and processing. Overall, this study suggests that, while most features of HGSC tumor phenotypes are similar in Black and White populations, there may be clinically-relevant differences. If validated, these phenotypes may be important for clinical decision-making and would have been missed by characterizing tumors from White individuals only.",10/03/2025,Cancer research
10.1038/s41586-025-08668-x,Spatial immune scoring system predicts hepatocellular carcinoma recurrence,"Gengjie Jia,Peiqi He,Tianli Dai,Denise Goh,Jiabei Wang,Mengyuan Sun,Felicia Wee,Fuling Li,Jeffrey Chun Tatt Lim,Shuxia Hao,Yao Liu,Tony Kiat Hon Lim,Nye-Thane Ngo,Qingping Tao,Wei Wang,Ahitsham Umar,Björn Nashan,Yongchang Zhang,Chen Ding,Joe Yeong,Lianxin Liu,Cheng Sun","Given the high recurrence rates of hepatocellular carcinoma (HCC) post-resection 1-3 , improved early identification of patients at high risk for post-resection recurrence would help to improve patient outcomes and prioritize healthcare resources 4-6 . Here we observed a spatial and HCC recurrence-associated distribution of natural killer (NK) cells in the invasive front and tumour centre from 61 patients. Using extreme gradient boosting and inverse-variance weighting, we developed the tumour immune microenvironment spatial (TIMES) score based on the spatial expression patterns of five biomarkers (SPON2, ZFP36L2, ZFP36, VIM and HLA-DRB1) to predict HCC recurrence risk. The TIMES score (hazard ratio = 88.2, P < 0.001) outperformed current standard tools for patient risk stratification including the TNM and BCLC systems. We validated the model in 231 patients from five multicentred cohorts, achieving a real-world accuracy of 82.2% and specificity of 85.7%. The predictive power of these biomarkers emerged through the integration of their spatial distributions, rather than individual marker expression levels alone. In vivo models, including NK cell-specific Spon2-knockout mice, revealed that SPON2 enhances IFNγ secretion and NK cell infiltration at the invasive front. Our study introduces TIMES, a publicly accessible tool for predicting HCC recurrence risk, offering insights into its potential to inform treatment decisions for early-stage HCC.",12/03/2025,Nature
10.1016/j.foodchem.2018.04.067,Transglutaminase mediated microencapsulation of sea buckthorn supercritical CO2 extract in whey protein isolate and valorization in highly value added food products,"Liliana Mihalcea,Mihaela Turturică,Vasilica Barbu,Elena Ioniţă,Livia Pătraşcu,Mihaela Cotârleţ,Loredana Dumitraşcu,Iuliana Aprodu,Gabriela Râpeanu,Nicoleta Stănciuc","Sea buckthorn carotenoids extracted using CO 2 supercritical fluids method were encapsulated within whey proteins isolate by transglutaminase (TG) mediated crosslinking reaction, coacervation and freeze drying. The encapsulation efficiency was 36.23 ± 1.58%, with β-carotene the major carotenoid present in the powder. The confocal analysis revealed that TG-ase mediated cross-linking reaction enhanced the complexes stability to such a manner that a double microencapsulation was performed. The powder showed an antioxidant activity of 2.16 ± 0.14 mMol Trolox/g DW and an antifungal activity against Penicillium expansum MIUG M11. Four variants of domestic ice creams were obtained, with a total carotenoids content variation of 1.63 ± 0.03 mg/g D.W. in sample with 2% powder and 6.38 ± 0.04 mg/g D.W. in samples with 4% extract, having satisfactory antioxidant activity. The storage stability test showed a decrease in both total carotenoids content and antioxidant activity in all samples during 21 days at -18 °C. A protective effect of microencapsulation was evidenced.",01/10/2018,Food chemistry
10.1093/bjs/znaf005,"Extended pharmacological thromboprophylaxis and clinically relevant venous thromboembolism after major abdominal and pelvic surgery: international, prospective, propensity score-weighted cohort study",EuroSurg Collaborative and STARSurg Collaborative,Background: There is low-certainty evidence on the impact of extended pharmacological prophylaxis on venous thromboembolism-associated morbidity and mortality. The aim of this study was to determine the efficacy and safety of extended prophylaxis after major abdominopelvic surgery for the prevention of clinically relevant venous thromboembolism after hospital discharge.,04/03/2025,The British journal of surgery
10.3390/ijms26052320,Unveiling Gestational Diabetes: An Overview of Pathophysiology and Management,"Rahul Mittal,Karan Prasad,Joana R N Lemos,Giuliana Arevalo,Khemraj Hirani","Gestational diabetes mellitus (GDM) is characterized by an inadequate pancreatic β-cell response to pregnancy-induced insulin resistance, resulting in hyperglycemia. The pathophysiology involves reduced incretin hormone secretion and signaling, specifically decreased glucagon-like peptide-1 (GLP-1) and glucose-dependent insulinotropic polypeptide (GIP), impairing insulinotropic effects. Pro-inflammatory cytokines, including tumor necrosis factor-alpha (TNF-α) and interleukin-6 (IL-6), impair insulin receptor substrate-1 (IRS-1) phosphorylation, disrupting insulin-mediated glucose uptake. β-cell dysfunction in GDM is associated with decreased pancreatic duodenal homeobox 1 (PDX1) expression, increased endoplasmic reticulum stress markers (CHOP, GRP78), and mitochondrial dysfunction leading to impaired ATP production and reduced glucose-stimulated insulin secretion. Excessive gestational weight gain exacerbates insulin resistance through hyperleptinemia, which downregulates insulin receptor expression via JAK/STAT signaling. Additionally, hypoadiponectinemia decreases AMP-activated protein kinase (AMPK) activation in skeletal muscle, impairing GLUT4 translocation. Placental hormones such as human placental lactogen (hPL) induce lipolysis, increasing circulating free fatty acids which activate protein kinase C, inhibiting insulin signaling. Placental 11β-hydroxysteroid dehydrogenase type 1 (11β-HSD1) overactivity elevates cortisol levels, which activate glucocorticoid receptors to further reduce insulin sensitivity. GDM diagnostic thresholds (≥92 mg/dL fasting, ≥153 mg/dL post-load) are lower than type 2 diabetes to prevent fetal hyperinsulinemia and macrosomia. Management strategies focus on lifestyle modifications, including dietary carbohydrate restriction and exercise. Pharmacological interventions, such as insulin or metformin, aim to restore AMPK signaling and reduce hepatic glucose output. Emerging therapies, such as glucagon-like peptide-1 receptor (GLP-1R) agonists, show potential in improving glycemic control and reducing inflammation. A mechanistic understanding of GDM pathophysiology is essential for developing targeted therapeutic strategies to prevent both adverse pregnancy outcomes and the progression to overt diabetes in affected women.",05/03/2025,International journal of molecular sciences
10.1016/S0140-6736(24)02722-3,"Ivonescimab versus pembrolizumab for PD-L1-positive non-small cell lung cancer (HARMONi-2): a randomised, double-blind, phase 3 study in China","Anwen Xiong,Lei Wang,Jianhua Chen,Lin Wu,Baogang Liu,Jun Yao,Hua Zhong,Jie Li,Ying Cheng,Yulan Sun,Hui Ge,Jifang Yao,Qin Shi,Ming Zhou,Bolin Chen,Zhengxiang Han,Jinliang Wang,Qing Bu,Yanqiu Zhao,Junqiang Chen,Ligong Nie,Gaofeng Li,Xingya Li,Xinmin Yu,Yinghua Ji,Daqiang Sun,Xiaohong Ai,Qian Chu,Yu Lin,Jiqing Hao,Dingzhi Huang,Chengzhi Zhou,Jinlu Shan,Hongzhong Yang,Xuewen Liu,Jing Wang,Yanhong Shang,Xiaodong Mei,Jie Yang,Dongmei Lu,Mingxiu Hu,Zhongmin Maxwell Wang,Baiyong Li,Michelle Xia,Caicun Zhou","Background: Ivonescimab is a bispecific antibody against programmed cell death protein 1 and vascular endothelial growth factor, yielding promising clinical outcomes for patients with advanced non-small cell lung cancer in early-phase studies. We compared the efficacy and safety of ivonescimab with pembrolizumab in patients with programmed cell death ligand-1 (PD-L1)-positive advanced non-small cell lung cancer.",08/03/2025,"Lancet (London, England)"
10.1016/j.ccell.2025.02.009,Single-cell multi-stage spatial evolutional map of esophageal carcinogenesis,"Jiang Chang,Junting Lu,Qingyi Liu,Tao Xiang,Shaosen Zhang,Yonglin Yi,Dongxu Li,Tianyuan Liu,Zeyuan Liu,Xinjie Chen,Zhenghao Dong,Cainan Li,HanZhang Yi,Siqi Yu,Luwei Huang,Fangfei Qu,Mengdi Wang,Dehe Wang,Hao Dong,Guoyu Cheng,Liang Zhu,Jiachen Li,Chenying Li,Pujie Wu,Xiaoting Xie,Andrew E Teschendorff,Dongxin Lin,Xiaoqun Wang,Chen Wu","Cancer development involves the co-evolution of cancer cells and their surrounding microenvironment, yet the dynamics of this interaction within the physical architecture remains poorly understood. Here, we present a spatial transcriptomic map at single-cell resolution, encompassing 127 multi-stage fields of view from 43 patients, to chart the evolutionary trajectories of human esophageal squamous cell carcinoma (ESCC). By analyzing 6.4 million cells, we reveal that ESCC progression is driven by a proliferative epithelial cell subpopulation that acquires dedifferentiated and invasive characteristics. At the late precancerous stage, these cells disrupt the epithelial-stromal interface and recruit normal fibroblasts via JAG1-NOTCH1 signaling, transforming them into cancer-associated fibroblasts (CAFs). This interaction leads to the formation of a ""CAF-Epi"" (CAF and epithelial cell) niche at the tumor edge that shields the tumor from immune surveillance. The CAF-Epi niche formation is a key indicator of progression in ESCC and other squamous cell carcinomas and patient outcomes.",10/03/2025,Cancer cell
10.7861/clinmedicine.15-6-565a,"Tackling emerging infections: clinical and public health lessons from the West African Ebola virus disease outbreak, 2014-2015","Naomi F Walker,Christopher Jm Whitty",Sin Abstract,12/2015,"Clinical medicine (London, England)"
10.1038/s41588-025-02077-6,Alterations in PD-L1 succinylation shape anti-tumor immune responses in melanoma,"Long Liang,Xinwei Kuang,Yi He,Lin Zhu,Poyee Lau,Xin Li,Dingan Luo,Lan Gong,Wenbin Zhou,Fanglin Zhang,Xiaowei Liang,Zhuofeng Li,Bin Hu,Dandan Liu,Tao Ding,Hui Li,Shuang Zhao,Juan Su,Mien-Chie Hung,Jing Liu,Hong Liu,Xiang Chen","Tumors undergo metabolic reprogramming to meet the energetic, synthetic and redox demands essential for malignancy, often characterized by increased glycolysis and lactate production. However, the role of mitochondrial metabolism in tumor immunity remains unclear. The present study integrates spatial transcriptomics, bulk transcriptomics and proteomics, revealing a strong link between the metabolite succinyl-CoA and tumor immunity as well as the efficacy of anti-programmed cell death protein-1 (PD-1) therapy in patients with melanoma. Elevated succinyl-CoA levels, through α-ketoglutarate or succinate supplementation, enhanced T cell-mediated tumor elimination, both in vitro and in vivo. Mechanistically, succinylation of the ligand of PD-1 (PD-L1) at lysine 129 led to its degradation. Increased carnitine palmitoyltransferase 1A (CPT1A), identified as a succinyltransferase for PD-L1, boosted anti-tumor activity. Preclinically, bezafibrate, a hyperlipidemia drug, upregulated CPT1A and synergized with CTLA-4 monoclonal antibody to inhibit tumor growth. Clinically, higher PD-L1 and lower CPT1A levels in tumors correlated with better anti-PD-1 therapy responses, suggesting potential biomarkers for prediction of treatment efficacy.",03/2025,Nature genetics
10.1038/s41586-025-08677-w,"Hepatic stellate cells control liver zonation, size and functions via R-spondin 3","Atsushi Sugimoto,Yoshinobu Saito,Guanxiong Wang,Qiuyan Sun,Chuan Yin,Ki Hong Lee,Yana Geng,Presha Rajbhandari,Celine Hernandez,Marcella Steffani,Jingran Qie,Thomas Savage,Dhruv M Goyal,Kevin C Ray,Taruna V Neelakantan,Deqi Yin,Johannes Melms,Brandon M Lehrich,Tyler M Yasaka,Silvia Liu,Michael Oertel,Tian Lan,Adrien Guillot,Moritz Peiseler,Aveline Filliol,Hiroaki Kanzaki,Naoto Fujiwara,Samhita Ravi,Benjamin Izar,Mario Brosch,Jochen Hampe,Helen Remotti,Josepmaria Argemi,Zhaoli Sun,Timothy J Kendall,Yujin Hoshida,Frank Tacke,Jonathan A Fallowfield,Storm K Blockley-Powell,Rebecca A Haeusler,Jonathan B Steinman,Utpal B Pajvani,Satdarshan P Monga,Ramon Bataller,Mojgan Masoodi,Nicholas Arpaia,Youngmin A Lee,Brent R Stockwell,Hellmut G Augustin,Robert F Schwabe","Hepatic stellate cells (HSCs) have a central pathogenetic role in the development of liver fibrosis. However, their fibrosis-independent and homeostatic functions remain poorly understood 1-5 . Here we demonstrate that genetic depletion of HSCs changes WNT activity and zonation of hepatocytes, leading to marked alterations in liver regeneration, cytochrome P450 metabolism and injury. We identify R-spondin 3 (RSPO3), an HSC-enriched modulator of WNT signalling, as responsible for these hepatocyte-regulatory effects of HSCs. HSC-selective deletion of Rspo3 phenocopies the effects of HSC depletion on hepatocyte gene expression, zonation, liver size, regeneration and cytochrome P450-mediated detoxification, and exacerbates alcohol-associated and metabolic dysfunction-associated steatotic liver disease. RSPO3 expression decreases with HSC activation and is inversely associated with outcomes in patients with alcohol-associated and metabolic dysfunction-associated steatotic liver disease. These protective and hepatocyte-regulating functions of HSCs via RSPO3 resemble the R-spondin-expressing stromal niche in other organs and should be integrated into current therapeutic concepts.",12/03/2025,Nature
10.1038/s41586-025-08721-9,MYC ecDNA promotes intratumour heterogeneity and plasticity in PDAC,"Elena Fiorini,Antonia Malinova,Daniel Schreyer,Davide Pasini,Michele Bevere,Giorgia Alessio,Diego Rosa,Sabrina D'Agosto,Luca Azzolin,Salvatore Milite,Silvia Andreani,Francesca Lupo,Lisa Veghini,Sonia Grimaldi,Serena Pedron,Monica Castellucci,Craig Nourse,Roberto Salvia,Giuseppe Malleo,Andrea Ruzzenente,Alfredo Guglielmi,Michele Milella,Rita T Lawlor,Claudio Luchini,Antonio Agostini,Carmine Carbone,Christian Pilarsky,Andrea Sottoriva,Aldo Scarpa,David A Tuveson,Peter Bailey,Vincenzo Corbo","Intratumour heterogeneity and phenotypic plasticity drive tumour progression and therapy resistance 1,2 . Oncogene dosage variation contributes to cell-state transitions and phenotypic heterogeneity 3 , thereby providing a substrate for somatic evolution. Nonetheless, the genetic mechanisms underlying phenotypic heterogeneity are still poorly understood. Here we show that extrachromosomal DNA (ecDNA) is a major source of high-level focal amplification in key oncogenes and a major contributor of MYC heterogeneity in pancreatic ductal adenocarcinoma (PDAC). We demonstrate that ecDNAs drive varying levels of MYC dosage, depending on their regulatory landscape, enabling cancer cells to rapidly and reversibly adapt to microenvironmental changes. In the absence of selective pressure, a high ecDNA copy number imposes a substantial fitness cost on PDAC cells. We also show that MYC dosage affects cell morphology and dependence of cancer cells on stromal niche factors. Our work provides a detailed analysis of ecDNAs in PDAC and describes a new genetic mechanism driving MYC heterogeneity in PDAC.",12/03/2025,Nature
10.1016/j.ccell.2025.02.015,Hypoxia inducible factor-1α drives cancer resistance to cuproptosis,"Zhou Yang,Wei Su,Xiyi Wei,Yitong Pan,Mengying Xing,Lili Niu,Baijie Feng,Weiyu Kong,Xiaohan Ren,Feng Huang,Jingwan Zhou,Wei Zhao,Yingyi Qiu,Tian Liao,Qi Chen,Shuang Qu,Yunjun Wang,Qing Guan,Duanshu Li,Ke Zen,Yun Chen,Chao Qin,Yu Wang,Xiang Zhou,Jun Xiang,Bing Yao","Cuproptosis represents a new type of cell death that intricately associated with copper homeostasis and protein lipoylation. The cuproptosis suppression has been characterized in the hypoxic tumor microenvironment (TME). Here we reveal that hypoxia inducible factor-1α (HIF-1α) is a driver of cuproptosis resistance in solid tumor. We found that HIF-1α activates pyruvate dehydrogenase kinase 1 and 3 (PDK1/3), resulting in decreased expression of dihydrolipoamide S-acetyltransferase (DLAT) (target of copper), and promotes the accumulation of metallothionein, which sequesters mitochondrial copper, leading to resistance to cuproptosis under hypoxic conditions. Furthermore, we discovered that high levels of copper reduce ubiquitination and increase the stability of HIF-1α protein without affecting its mRNA levels. Inhibition of HIF-1α increases the susceptibility of cancer to cuproptosis in vivo. This study unveils the multifaceted role of HIF-1α in cuproptosis and demonstrates the molecular mechanism of hypoxia-promoted carcinogenesis.",04/03/2025,Cancer cell
10.1016/j.biortech.2011.11.059,A novel and efficient method for the immobilization of thermolysin using sodium chloride salting-in and consecutive microwave irradiation,"Feifei Chen,Fangkai Zhang,Fangchuan Du,Anming Wang,Weifang Gao,Qiuyan Wang,Xiaopu Yin,Tian Xie","Sodium chloride salting-in and microwave irradiation were combined to drive thermolysin molecules into mesoporous support to obtain efficiently immobilized enzyme. When the concentration of sodium chloride was 3 M and microwave power was 40 W, 93.2% of the enzyme was coupled to the support by 3 min, and the maximum specific activity of the immobilized enzyme was 17,925.1 U mg(-1). This was a 4.5-fold increase in activity versus enzyme immobilized using conventional techniques, and a 1.6-fold increase versus free enzyme. Additionally, the thermal stability of the immobilized thermolysin was significantly improved. When incubated at 70°C, there was no reduction in activity by 3.5h, whereas free thermolysin lost most of its activity by 3h. Immobilization also protected the thermolysin against organic solvent denaturation. The microwave-assisted immobilization technique, combined with sodium chloride salting-in, could be applied to other sparsely soluble enzymes immobilization because of its simplicity and high efficiency.",07/2012,Bioresource technology
10.1016/j.ccell.2025.02.014,Targeting tumor monocyte-intrinsic PD-L1 by rewiring STING signaling and enhancing STING agonist therapy,"Huan Song,Lin Chen,Xuanxuan Pan,Yuru Shen,Maolin Ye,Guohong Wang,Can Cui,Qi Zhou,Yujen Tseng,Zheng Gong,Bin Zhong,Haoshu Cui,Shaocong Mo,Jiayue Zheng,Bryan Jin,Wanwei Zheng,Feifei Luo,Jie Liu","STING is an important DNA sensing machinery in initiating immune response, yet therapies targeting STING have shown poor outcomes in clinical trials. Here, we reveal that STING signaling induces PD-L1 hi tumor monocytes (Tu.Mons) that dominate the resistance against STING agonist therapy. Cell-intrinsic PD-L1, induced by the STING-IRF3-IFN-I axis, is identified as the driving factor for protumoral PD-L1 hi Tu.Mons. Notably, TLR2-activated Tu.Mons resist STING-induced upregulation of cell-intrinsic PD-L1 and the associated protumoral functions. Mechanistically, TLR2 stimulation remodels STING signaling by facilitating STING and TRAF6 interaction, which suppresses the IRF3-IFN-I response and enhances NF-κB activation. Moreover, we demonstrate that combining STING agonists with TLR2 agonist pretreatment significantly improves antitumor efficacy in murine syngeneic and humanized models. Our findings uncover a protumoral aspect of STING activation mediated by cell-intrinsic PD-L1 and propose a promising strategy to boost antitumor immunity by fine-tuning STING signaling outputs.",10/03/2025,Cancer cell
10.1161/CIRCRESAHA.124.325049,March2 Alleviates Aortic Aneurysm/Dissection by Regulating PKM2 Polymerization,"Yiran E Li,Shuolin Liu,Litao Wang,Yuxin Du,Lin Wu,Haoran Chen,Tingfang Zhu,Jie Lin,Shengjun Xiong,Yayu Wang,Qijun Zheng,Rongjun Zou,Ling Lin,Zheyun Li,Lixin Wang,Junbo Ge,Jun Ren,Yingmei Zhang","Background: Aortic aneurysm/dissection (AAD) is a life-threatening disease lacking effective pharmacological treatment. Protein ubiquitination plays a pivotal role in cardiovascular diseases. However, the possible contribution of the E3 ubiquitin ligase March2 (membrane-associated RING finger protein 2) to the cause of AAD remains elusive.",13/03/2025,Circulation research
10.1016/S0140-6736(25)00355-1,"Global, regional, and national prevalence of adult overweight and obesity, 1990-2021, with forecasts to 2050: a forecasting study for the Global Burden of Disease Study 2021",GBD 2021 Adult BMI Collaborators,"Background: Overweight and obesity is a global epidemic. Forecasting future trajectories of the epidemic is crucial for providing an evidence base for policy change. In this study, we examine the historical trends of the global, regional, and national prevalence of adult overweight and obesity from 1990 to 2021 and forecast the future trajectories to 2050.",08/03/2025,"Lancet (London, England)"
10.1126/sciadv.adr3757,Genetically supported targets and drug repurposing for brain aging: A systematic study in the UK Biobank,"Fan Yi,Jing Yuan,Judith Somekh,Mor Peleg,Yi-Cheng Zhu,Zhilong Jia,Fei Wu,Zhengxing Huang","Brain age gap (BAG), the deviation between estimated brain age and chronological age, is a promising marker of brain health. However, the genetic architecture and reliable targets for brain aging remains poorly understood. In this study, we estimate magnetic resonance imaging (MRI)-based brain age using deep learning models trained on the UK Biobank and validated with three external datasets. A genome-wide association study for BAG identified two unreported loci and seven previously reported loci. By integrating Mendelian Randomization (MR) and colocalization analysis on eQTL and pQTL data, we prioritized seven genetically supported druggable genes, including MAPT , TNFSF12 , GZMB , SIRPB1 , GNLY , NMB , and C1RL , as promising targets for brain aging. We rediscovered 13 potential drugs with evidence from clinical trials of aging and prioritized several drugs with strong genetic support. Our study provides insights into the genetic basis of brain aging, potentially facilitating drug development for brain aging to extend the health span.",14/03/2025,Science advances
10.1016/j.jbc.2025.108323,Cyclophilin J limits linear ubiquitin signaling and controls colorectal cancer progression,"Chunjie Sheng,Chen Yao,Jing Wang,Yizhi Mao,Lingyi Fu,Shuai Chen",Sin Abstract,10/03/2025,The Journal of biological chemistry
10.1016/S0140-6736(25)00326-5,Dengue virus epidemic: physical vector control success in Timor-Leste,"Emily Ying Yang Chan,Caroline Dubois,Cheuk-Yu Andrea Chan,Chun-Ying Leung",Sin Abstract,07/03/2025,"Lancet (London, England)"
