DOI,Titulo,Autores,Abstract,Fecha,Seccion
10.1002/ctm2.70271,p53 inhibits OTUD5 transcription to promote GPX4 degradation and induce ferroptosis in gastric cancer,"Junjing Zhang,Tongguan Tian,Xinxing Li,Kai Xu,Yao Lu,Xia Li,Xinyu Zhao,Ziyi Cui,Zhenxiang Wang,Yuefan Zhou,Yixin Xu,Hongchen Li,Yan Zhang,Yu Du,Lei Lv,Yanping Xu","Background: Gastric cancer is one of the most prevalent malignant tumors within the digestive system, and ferroptosis playing a crucial role in its progression. Glutathione peroxidase 4 (GPX4), a key negative regulator of ferroptosis, is highly expressed in gastric cancer and contributes to tumor growth. Targeting the regulation of GPX4 has emerged as a promising approach to induce ferroptosis and develop effective therapy for gastric cancer.",03/2025,Clinical and translational medicine
10.1186/s13046-025-03329-3,CRSP8-driven fatty acid metabolism reprogramming enhances hepatocellular carcinoma progression by inhibiting RAN-mediated PPARα nucleus-cytoplasm shuttling,"Yuxi Lin,Zhixing Liang,Zhiyan Weng,Xiaofang Liu,Feng Zhang,Yutian Chong","Background: In-depth exploration into the dysregulation of lipid metabolism in hepatocellular carcinoma (HCC) has contributed to the development of advanced antitumor strategies. CRSP8 is a critical component of mediator multiprotein complex involved in transcriptional recruiting. However, the regulatory mechanisms of CRSP8 on fatty acid metabolism reprogramming and HCC progression remain unclear.",11/03/2025,Journal of experimental & clinical cancer research : CR
10.3324/haematol.2024.287010,Real-world comparison of lisocabtagene maraleucel and axicabtagene ciloleucel in large B-cell lymphoma: an inverse probability of treatment weighting analysis with 3-year follow up,"Andrew J Portuguese,Jennifer J Huang,Yein Jeon,Mahnoosh Taheri,Aya Albittar,Emily C Liang,Alexandre V Hirayama,Erik L Kimble,Lorenzo Iovino,Christina Poh,Ajay K Gopal,Mazyar Shadman,Brian G Till,Filippo Milano,Aude G Chapuis,Folashade Otegbeye,Ryan D Cassaday,Ryan S Basom,Qian Vicky Wu,David G Maloney,Jordan Gauthier","Lisocabtagene maraleucel (liso-cel) and axicabtagene ciloleucel (axi-cel) are FDA- and EMAapproved chimeric antigen receptor (CAR) T-cell therapies for relapsed/refractory large B-cell lymphoma (LBCL). However, comparative real-world analyses of their efficacy and toxicity with extended follow-up are lacking. We conducted a retrospective study of 160 LBCL patients treated at the Fred Hutchinson Cancer Center with commercial liso-cel or axi-cel per standard of care. Using inverse probability of treatment weighting (IPTW) to mitigate treatment allocation bias and multivariable adjustments to minimize other sources of confounding, we assessed the impact of CAR T-cell product type on outcomes. Axi-cel was associated with significantly higher rates of cytokine release syndrome (CRS; G1+: adjusted OR [aOR] 4.27, p=0.004; G2+: aOR 2.88, p=0.006), immune effector cell-associated neurotoxicity syndrome (ICANS; G1+: aOR 2.10, p=0.048), and immune effector cell-associated hematotoxicity (ICAHT; G1+: aOR 8.09, p.",13/03/2025,Haematologica
10.1002/ctm2.70272,PADI4 facilitates stem-like properties and cisplatin resistance through upregulating PRMT2/IDs family in oesophageal squamous cell carcinoma,"Zeyu Wang,Hao Wu,Zhaoxing Li,Zhukai Chen,Anqi Feng,Yuan Chu,Kang Fang,Zehua Zhang,Ziying Zhao,Zhuyun Leng,Shihan Zhang,Xiaoyuan Wang,Lingnan He,Tao Chen,Meidong Xu",Background: Oesophageal squamous cell carcinoma (OSCC) is a highly lethal cancer characterized by its aggressive nature and chemotherapy resistance. Peptidylarginine deiminase 4 (PADI4) regulates protein citrullination and is associated with various cancer developments. The role of PADI4 in OSCC progression and chemoresistance remains unexplored.,03/2025,Clinical and translational medicine
10.1038/s41586-025-08681-0,The earliest human face of Western Europe,"Rosa Huguet,Xosé Pedro Rodríguez-Álvarez,María Martinón-Torres,Josep Vallverdú,Juan Manuel López-García,Marina Lozano,Marcos Terradillos-Bernal,Isabel Expósito,Andreu Ollé,Elena Santos,Palmira Saladié,Arturo de Lombera-Hermida,Elena Moreno-Ribas,Laura Martín-Francés,Ethel Allué,Carmen Núñez-Lahuerta,Jan van der Made,Julia Galán,Hugues-Alexandre Blain,Isabel Cáceres,Antonio Rodríguez-Hidalgo,Amèlia Bargalló,Marina Mosquera,Josep Maria Parés,Juan Marín,Antonio Pineda,David Lordkipanidze,Ann Margveslashvili,Juan Luis Arsuaga,Eudald Carbonell,José María Bermúdez de Castro","Who the first inhabitants of Western Europe were, what their physical characteristics were, and when and where they lived are some of the pending questions in the study of the settlement of Eurasia during the Early Pleistocene epoch. The available palaeoanthropological information from Western Europe is limited and confined to the Iberian Peninsula 1,2 . Here we present most of the midface of a hominin found at the TE7 level of the Sima del Elefante site (Sierra de Atapuerca, Spain), dated to between 1.4 million and 1.1 million years ago. This fossil (ATE7-1) represents the earliest human face of Western Europe identified thus far. Most of the morphological features of the midface of this hominin are primitive for the Homo clade and they do not display the modern-like aspect exhibited by Homo antecessor found at the neighbouring Gran Dolina site, also in the Sierra de Atapuerca, and dated to between 900,000 and 800,000 years ago 3 . Furthermore, ATE7-1 is more derived in the nasoalveolar region than the Dmanisi and other roughly contemporaneous hominins. On the basis of the available evidence, it is reasonable to assign the new human remains from TE7 level to Homo aff. erectus. From the archaeological, palaeontological and palaeoanthropological information obtained in the lower levels of the Sima del Elefante and Gran Dolina sites 4-8 , we suggest a turnover in the human population in Europe at the end of the Early Pleistocene.",12/03/2025,Nature
10.1126/sciadv.adt1241,Lipoylation inhibition enhances radiation control of lung cancer by suppressing homologous recombination DNA damage repair,"Jui-Chung Chiang,Zengfu Shang,Tracy Rosales,Ling Cai,Wei-Min Chen,Feng Cai,Hieu Vu,John D Minna,Min Ni,Anthony J Davis,Robert D Timmerman,Ralph J DeBerardinis,Yuanyuan Zhang","Lung cancer exhibits altered metabolism, influencing its response to radiation. To investigate the metabolic regulation of radiation response, we conducted a comprehensive, metabolic-wide CRISPR-Cas9 loss-of-function screen using radiation as selection pressure in human non-small cell lung cancer. Lipoylation emerged as a key metabolic target for radiosensitization, with lipoyltransferase 1 (LIPT1) identified as a top hit. LIPT1 covalently conjugates mitochondrial 2-ketoacid dehydrogenases with lipoic acid, facilitating enzymatic functions involved in the tricarboxylic acid cycle. Inhibiting lipoylation, either through genetic LIPT1 knockout or a lipoylation inhibitor (CPI-613), enhanced tumor control by radiation. Mechanistically, lipoylation inhibition increased 2-hydroxyglutarate, leading to H3K9 trimethylation, disrupting TIP60 recruitment and ataxia telangiectasia mutated (ATM)-mediated DNA damage repair signaling, impairing homologous recombination repair. In summary, our findings reveal a critical role of LIPT1 in regulating DNA damage and chromosome stability and may suggest a means to enhance therapeutic outcomes with DNA-damaging agents.",14/03/2025,Science advances
10.3390/cells14050347,Age-Related Neurodegenerative Diseases: A Stem Cell's Perspective,"Belén Calvo,Pierre Schembri-Wismayer,María Beatriz Durán-Alonso","Neurodegenerative diseases encompass a number of very heterogeneous disorders, primarily characterized by neuronal loss and a concomitant decline in neurological function. Examples of this type of clinical condition are Alzheimer's Disease, Parkinson's Disease, Huntington's Disease and Amyotrophic Lateral Sclerosis. Age has been identified as a major risk in the etiology of these disorders, which explains their increased incidence in developed countries. Unfortunately, despite continued and intensive efforts, no cure has yet been found for any of these diseases; reliable markers that allow for an early diagnosis of the disease and the identification of key molecular events leading to disease onset and progression are lacking. Altered adult neurogenesis appears to precede the appearance of severe symptoms. Given the scarcity of human samples and the considerable differences with model species, increasingly complex human stem-cell-based models are being developed. These are shedding light on the molecular alterations that contribute to disease development, facilitating the identification of new clinical targets and providing a screening platform for the testing of candidate drugs. Moreover, the secretome and other promising features of these cell types are being explored, to use them as replacement cells of high plasticity or as co-adjuvant therapy in combinatorial treatments.",27/02/2025,Cells
10.1016/j.cell.2025.01.038,From big data and experimental models to clinical trials: Iterative strategies in microbiome research,"Sondra Turjeman,Tommaso Rozera,Eran Elinav,Gianluca Ianiro,Omry Koren","Microbiome research has expanded significantly in the last two decades, yet translating findings into clinical applications remains challenging. This perspective discusses the persistent issue of correlational studies in microbiome research and proposes an iterative method leveraging in silico, in vitro, ex vivo, and in vivo studies toward successful preclinical and clinical trials. The evolution of research methodologies, including the shift from small cohort studies to large-scale, multi-cohort, and even ""meta-cohort"" analyses, has been facilitated by advancements in sequencing technologies, providing researchers with tools to examine multiple health phenotypes within a single study. The integration of multi-omics approaches-such as metagenomics, metatranscriptomics, metaproteomics, and metabolomics-provides a comprehensive understanding of host-microbe interactions and serves as a robust hypothesis generator for downstream in vitro and in vivo research. These hypotheses must then be rigorously tested, first with proof-of-concept experiments to clarify the causative effects of the microbiota, and then with the goal of deep mechanistic understanding. Only following these two phases can preclinical studies be conducted with the goal of translation into the clinic. We highlight the importance of combining traditional microbiological techniques with big-data approaches, underscoring the necessity of iterative experiments in diverse model systems to enhance the translational potential of microbiome research.",06/03/2025,Cell
10.1093/cvr/cvaf040,Cardiac ischemia/reperfusion increases cardiomyocyte KLF5 in pigs and mice that aggravates tissue injury and remodeling,"Nikolaos Mylonas,Georgios Siokatas,Effimia Zacharia,Christine Pol,Tyler Rolland,Ioannis D Kyriazis,Matthew Hoffman,Alycia Hildebrand,Thomas Bannister,Erhe Gao,Ira J Goldberg,Vincent W Yang,Agnieszka B Bialkowska,John Elrod,John M Canty Jr,Ioanna Andreadou,Brian Weil,Konstantinos Drosatos",Aims: Activation of the transcriptional factor Krüppel-like factor 5 (KLF5) is detrimental to chronic heart failure. We explored the involvement of KLF5 in myocardial ischemia/reperfusion injury.,13/03/2025,Cardiovascular research
10.1002/adhm.202403892,"Injectable Nanocomposite Hydrogels for Intervertebral Disc Degeneration: Combating Oxidative Stress, Mitochondrial Dysfunction, and Ferroptosis","Zhenyu Guo,Xinzhou Wang,Jing Sun,QiZhu Chen,Linjie Chen,Ouqiang Wu,Yuxin Jin,Taidong Lyu,Jones Morgan,Yan Michael Li,Hao Zhou,Yongcheng Chen,Xiuling You,Yunlong Zhou,Yu Chen,Qiuping Qian,Aimin Wu","Intervertebral disc degeneration (IVDD) is a major cause of low back pain, where oxidative stress and mitochondrial dysfunction are key contributors. Additionally, ferroptosis, an iron-dependent form of cell death, is identified as a critical mechanism in IVDD pathogenesis. Herein, the therapeutic potential of gallic acid (GA)-derived PGA-Cu nanoparticles, enhanced with functional octapeptide (Cys-Lys-His-Gly-d-Arg-d-Tyr-Lys-Phe, SS08) to build the mitochondria-targeted nanoparticles (PGA-Cu@SS08), and embedded within a hydrogel matrix to form a nanocomposite hydrogel, is explored. The nanoparticles show targeted localization within mitochondria, effectively scavenging reactive oxygen species and preserving mitochondrial function. The abundant phenolic hydroxyl groups present on the nanoparticle surface, along with the histidine residue of the SS08 peptide, endow these entities with the capacity to chelate iron. Through RNA sequencing analysis, it is discovered that PGA-Cu@SS08 activates the NRF2 signaling pathway, mitigating ferroptosis. It also reduces iron overload by inhibiting the autophagy of iron storage proteins. Additionally, the nanocomposite hydrogels exhibit excellent biocompatibility and biodegradability, along with enhanced mechanical properties that improve intervertebral disc (IVD) performance. PGA-Cu@SS08 is continuously released from these hydrogels, restoring IVD height and maintaining tissue hydration levels, thus facilitating future applications for alleviating IVDD.",13/03/2025,Advanced healthcare materials
10.3389/fimmu.2025.1538302,Natural products for the treatment of ulcerative colitis: focus on the JAK/STAT pathway,"Dan Long,Chenhan Mao,Wei Zhang,Ying Zhu,Yin Xu","Ulcerative colitis (UC) is an autoimmune disease with an incompletely understood pathogenesis. The Janus kinase (JAK)/signal transducer and activator of transcription (STAT) signaling pathway plays a key role in immune response and inflammation. More and more studies demonstrated that JAK/STAT signaling pathway is associated with the pathogenesis of UC. The JAK/STAT pathway affects UC in multiple ways by regulating intestinal inflammatory response, affecting intestinal mucosal barrier, modulating T cell homeostasis, and regulating macrophages. Encouragingly, natural products are promising candidates for the treatment of UC. Natural products have the advantage of being multi-targeted and rich in therapeutic modalities. This review summarized the research progress of JAK/STAT pathway-mediated UC. Furthermore, the latest studies on natural products targeting the JAK/STAT pathway for the treatment of UC were systematically summarized, including active ingredients such as arbutin, aloe polysaccharide, berberine, matrine, curcumin, Ginsenoside Rh2, and so on. The aim of this paper is to provide new ideas for drug development to regulate JAK/STAT signaling for treating UC.",26/02/2025,Frontiers in immunology
10.3390/ijms26052049,"Lung Cancer-Epidemiology, Pathogenesis, Treatment and Molecular Aspect (Review of Literature)","Beata Smolarz,Honorata Łukasiewicz,Dariusz Samulak,Ewa Piekarska,Radosław Kołaciński,Hanna Romanowicz","Lung cancer is one of the most common malignant cancers in most countries and is the leading cause of death among cancer diseases worldwide. Despite constant progress in diagnosis and therapy, survival rates of patients diagnosed with lung cancer remain unsatisfactory. Numerous epidemiological and experimental studies conducted as early as the 1970s confirm that the most important risk factor for the development of lung cancer is long-term smoking, which remains valid to this day. In the paper, the authors present the latest data on the epidemiology, pathogenesis, treatment and molecular aspects of this cancer. In the last decade, many molecular alterations that are effective in the development of lung cancer have been discovered. In adenocarcinoma, tyrosine kinase inhibitors were developed for EGFR mutations and ALK and ROS1 translocations and were approved for use in the treatment of advanced stage adenocarcinomas. In the case of squamous cell carcinoma, the evaluation of these mutations is not yet being used in clinical practice. In addition, there are ongoing studies concerning many potential therapeutic molecular targets, such as ROS, MET, FGFR, DDR-2 and RET. Constant progress in diagnostic and therapeutic methods gives rise to hopes for an improved prognosis in patients with lung cancer.",26/02/2025,International journal of molecular sciences
10.1016/j.jcin.2024.11.038,Global Algorithm for the Endovascular Treatment of Chronic Femoropopliteal Lesions: An Interdisciplinary Expert Opinion Statement,"Grigorios Korosoglou,Andrej Schmidt,Michael Lichtenberg,Nasser Malyar,Konstantinos Stavroulakis,Holger Reinecke,Gerd Grözinger,Lorenzo Patrone,Ramon L Varcoe,Peter A Soukas,Dittmar Böckler,Christian-Alexander Behrendt,Eric A Secemsky,Thomas Zeller,Erwin Blessing,Ralf Langhoff,Christos Rammos","A global treatment algorithm was developed for the endovascular revascularization of femoropopliteal lesions and chronic total occlusions, aiming toward a more standardized approach to endovascular treatment in patients with peripheral artery disease. The following steps are proposed. 1) Evaluation of lesion morphology based on preprocedural imaging by Duplex sonography and intravenous ultrasound for selection of lesion preparation tools. Lesion characteristics are mainly defined by calcification, lesion length, and the presence of total occlusion and in-stent restenosis. 2) Selection of vessel preparation strategies, which encompass plain old balloon angioplasty, atherectomy, thrombectomy, intravascular lithotripsy and specialty balloons, or a combination of the preceding, based on lesion and patient-specific characteristics. In addition, a Delphi consensus was applied for the appropriateness of lesion preparation strategies, depending on lesion anatomy, length, plaque morphology, and subintimal versus intraluminal guidewire crossing. 3) Definitive lesion treatment strategies using drug-coated balloons, bare-metal stents, drug-eluting stents, and/or covered stents or a combination. By establishing this treatment algorithm in routine practice, improvements in vessel- and patient-specific outcomes are anticipated, which will be further enhanced by continuous collaboration among experts from different countries and disciplines and by randomized controlled trials.",10/03/2025,JACC. Cardiovascular interventions
10.1126/sciadv.adr5448,Phagocytosis-driven neurodegeneration through opposing roles of an ABC transporter in neurons and phagocytes,"Xinchen Chen,Bei Wang,Ankita Sarkar,Zixian Huang,Nicolas Vergara Ruiz,Ann T Yeung,Rachael Chen,Chun Han","Lipid homeostasis is critical to neuronal survival. ATP-binding cassette A (ABCA) proteins are lipid transporters associated with neurodegenerative diseases. How ABCA transporters regulate lipid homeostasis in neurodegeneration is an outstanding question. Here we report that the Drosophila ABCA protein engulfment ABC transporter in the ovary (Eato) regulates phagocytosis-dependent neurodegeneration by playing opposing roles in neurons and phagocytes: In neurons, Eato prevents dendrites and axons from being attacked by neighboring phagocytes; in phagocytes, Eato sensitizes the cell for detecting neurons as engulfment targets. Thus, Eato deficiency in neurons alone causes phagocytosis-dependent neurite degeneration, but additional Eato loss from phagocytes suppresses the neurite degeneration. Mechanistically, Eato functions by removing the eat-me signal phosphatidylserine from the cell surface in both neurons and phagocytes. Multiple human and worm ABCA homologs can rescue Eato loss in phagocytes but not in neurons, suggesting both conserved and cell type-specific activities of ABCA proteins. These results imply possible mechanisms of neuron-phagocyte interactions in neurodegenerative diseases.",14/03/2025,Science advances
10.1126/sciadv.adt5439,Collaborative role of two distinct cilium-specific cytoskeletal systems in driving Hedgehog-responsive transcription factor trafficking,"Pei-I Ku,Jamuna S Sreeja,Abhishek Chadha,David S Williams,Martin F Engelke,Radhika Subramanian","In vertebrate Hedgehog (Hh) signaling, the precise output of the final effectors, GLI (glioma-associated oncogene) transcription factors, depends on the primary cilium. Upon pathway initiation, generating the precise levels of the activator form of GLI depends on its concentration at the cilium tip. The mechanisms underlying this critical step in Hh signaling are unclear. We developed an assay to visualize GLI2, the primary GLI activator isoform, at single-particle resolution within the cilium. We found that GLI2 is a cargo of intraflagellar transport (IFT) machinery. Anterograde-biased IFT loading of GLI2 in a restricted time window following pathway activation results in the tip accumulation of GLI2. Unexpectedly, we found that the conserved Hh regulator KIF7, a nonmotile kinesin, is important for the temporal control of IFT-mediated GLI2 transport and retention of GLI2 at the cilium tip. Our findings underscore a design principle where a cilia-specific cytoskeletal transport system and an Hh pathway-specific cytoskeletal protein collaboratively regulate GLI2 trafficking for Hh signaling.",14/03/2025,Science advances
10.1093/ecco-jcc/jjaf041,"Definitions, Diagnosis and Management of Postoperative Recurrence in Crohn's Disease Patients with Permanent Ileostomy - A Systematic Review and Meta-Analysis","Suha Abushamma,Tesfaye Yadete,Neil Nero,Katherine Falloon,Claire E Parker,Maria T Abreu,Vineet Ahuja,Alessandro Armuzzi,Willem Bemelman,David H Bruining,Parakkal Deepak,Axel Dignass,Iris Dotan,Brian G Feagan,Clifton Fulmer,Jonas Halfvarson,Ailsa Hart,Stefan D Holubar,Rupert W Leong,Christopher Ma,Fernando Magro,Jeffrey D McCurdy,Neeraj Narula,Julian Panés,Tim Raine,Miguel Regueiro,Gerhard Rogler,Siddharth Singh,Miles P Sparrow,Antonino Spinelli,Julie Ann Van Koughnett,Sudheer K Vuyyuru,Virginia Solitano,Yuhong Yuan,Vipul Jairath,Florian Rieder","Background and aims: Over 10% of patients with Crohn's disease require permanent ileostomy. We aimed to summarize the existing data on diagnosis, definitions of recurrence, and management of Crohn's disease patients with permanent ileostomy.",10/03/2025,Journal of Crohn's & colitis
10.2147/DDDT.S509357,Vaccarin Ameliorates Renal Fibrosis by Inhibiting Ferroptosis via Nrf2/SLC7A11/GPX4 Signaling Pathway,"Mengjiao Cui,Qiming Xu,Lianxiang Duan,Jianrao Lu,Jing Hu","Purpose: Vaccarin is a natural flavonoid glycoside with anti-inflammatory, antioxidant and nephroprotective effects. However, the effects of vaccarin on renal fibrosis (RF) and its molecular mechanisms remain unclear. This study aimed to investigate the effects of vaccarin on RF and its molecular mechanisms.",06/03/2025,"Drug design, development and therapy"
10.1016/j.ccell.2025.02.017,Lymph node macrophages drive immune tolerance and resistance to cancer therapy by induction of the immune-regulatory cytokine IL-33,"Sara Lamorte,Rene Quevedo,Robbie Jin,Luke Neufeld,Zhe Qi Liu,M Teresa Ciudad,Sabelo Lukhele,Jessica Bruce,Shreya Mishra,Xin Zhang,Zaid Kamil Saeed,Hal Berman,Dana J Philpott,Stephen E Girardin,Shane Harding,David H Munn,Tak W Mak,Mikael C I Karlsson,David G Brooks,Tracy L McGaha","Apoptotic cells are immunosuppressive, creating a barrier in cancer treatment. Thus, we investigated immune responses to dying tumor cells after therapy in the tumor draining lymph node (TDLN). A key population responsible for clearing tumor material in the TDLN was medullary sinus macrophages (MSMs). Tumor debris phagocytosis by MSMs induces the cytokine IL-33, and blocking the IL-33 receptor (ST2) or deletion of Il33 in MSMs enhances therapy responses. Mechanistically, IL-33 activates T regulatory cells in TDLNs that migrate to the tumor to suppress CD8 + T cells. Therapeutically combining ST2 blockade, targeted kinase inhibitors, and anti-PD-1 immunotherapy increases CD8 + T cell activity promoting tumor regression. Importantly, we observe similar activity in human macrophages, and IL-33 expression in sentinel lymph nodes correlates with disease stage and survival in melanoma. Thus, our data identifies an IL-33-dependent immune response to therapy that attenuates therapy-induced anti-tumor immunity.",05/03/2025,Cancer cell
10.1186/s13054-025-05331-9,Efficacy and safety of gastrodin in preventing postoperative delirium following cardiac surgery: a randomized placebo controlled clinical trial,"Yun-Xiao Bai,Hui-Liang Wu,Wan-Li Xie,Xia Li,Jing-Jing Han,Jie Liu,Shi-Qiang Chen,Ping Yin,Nian-Guo Dong,Qing-Ping Wu","Background: Delirium and postoperative cognitive dysfunction (POCD) are common complications post-cardiac surgery, yet no specific medical intervention is currently recommended for prevention. This study aimed to evaluate the efficacy of gastrodin infusion in preventing delirium and POCD in critically ill patients following cardiac surgery.",11/03/2025,"Critical care (London, England)"
10.1186/s12951-025-03246-9,CREB1/CRTC2 regulated tubular epithelial-derived exosomal miR-93-3p promotes kidney injury induced by calcium oxalate via activating M1 polarization and macrophage extracellular trap formation,"Yushi Sun,Bojun Li,Baofeng Song,Yuqi Xia,Xiangjun Zhou,Fangyou Lin,Ting Rao,Fan Cheng","Background: Calcium oxalate (CaOx) crystals are known to cause renal injury and trigger inflammatory responses. However, the role of exosome-mediated epithelial-macrophage communication in CaOx-induced kidney injury remains unclear.",12/03/2025,Journal of nanobiotechnology
